{
  "id": "EQ:061",
  "canonical_name": "Integrated Information (ﾎｦ)",
  "canonical_form_latex": "",
  "canonical_form_ascii": "ﾎｦ = min I(X竄／past; X竄◦present|X竄タpast)",
  "hash": "sha256:48c3c4e7b1991d8209540aeeec6bd6366cc16d186b36121a01d2a6ee185621d5",
  "variables": [],
  "families": [
    "FAM:CONSCIOUSNESS"
  ],
  "principles": [],
  "source_provenance": [],
  "applies_in_repos": [
    "polyhedral-intelligence"
  ],
  "version": "1.0",
  "license": "CC0-1.0",
  "tags": [
    "consciousness",
    "integration",
    "iit"
  ],
  "aliases": [],
  "glyph": "笳寂旭",
  "glyph_name": "Glyph of Conscious Unity",
  "extracted_from": [
    {
      "file": "atlas_schema.json",
      "path": "F16 Consciousness",
      "extracted_at": "2026-05-04T14:32:37Z",
      "context_name": "Integrated Information (ﾎｦ)"
    }
  ]
}
