{
  "id": "EQ:101",
  "canonical_name": "Resonance Condition",
  "canonical_form_latex": "",
  "canonical_form_ascii": "ω_drive = ω_natural",
  "hash": "sha256:123d708810f0ba539bfa3b0cf3a701660c81bfe3d0671c4bea99fc6aaab5a595",
  "variables": [],
  "families": [],
  "principles": [
    "PRIN:RESONANCE"
  ],
  "source_provenance": [],
  "applies_in_repos": [
    "polyhedral-intelligence"
  ],
  "version": "1.0",
  "license": "CC0-1.0",
  "tags": [
    "resonance",
    "frequency",
    "amplification"
  ],
  "aliases": [],
  "glyph": "∿=∿",
  "glyph_name": "Glyph of Perfect Match",
  "extracted_from": [
    {
      "file": "atlas_schema.json",
      "path": "P06 Resonance",
      "extracted_at": "2026-05-04T14:32:37Z",
      "context_name": "Resonance Condition"
    }
  ]
}
