{
  "id": "EQ:098",
  "canonical_name": "Critical Exponent",
  "canonical_form_latex": "",
  "canonical_form_ascii": "M ∝ (T_c - T)^β near phase transition",
  "hash": "sha256:a7230b3f65a3c4874f4c42776702d7dc15820823e70e7790fcf96d57f8c2df08",
  "variables": [],
  "families": [],
  "principles": [
    "PRIN:EMERGENCE"
  ],
  "source_provenance": [],
  "applies_in_repos": [
    "polyhedral-intelligence"
  ],
  "version": "1.0",
  "license": "CC0-1.0",
  "tags": [
    "phase-transition",
    "scaling",
    "emergence"
  ],
  "aliases": [],
  "glyph": "●●↗∞",
  "glyph_name": "Glyph of Critical Point",
  "extracted_from": [
    {
      "file": "atlas_schema.json",
      "path": "P05 Emergence",
      "extracted_at": "2026-05-04T14:32:37Z",
      "context_name": "Critical Exponent"
    }
  ]
}
